<?xml version="1.0" encoding="UTF-8"?>
<!--Definimos el esquema-->
<!--Adicionalmente podemos escribir alguna anotacion-->
<xs:schema xmlns:xs="http://www.w3.org/2001/XMLSchema" >	
<xs:annotation>
	<xs:documentation>
		Este archivo valida al archivo de libro.xml
	</xs:documentation>
</xs:annotation>

<xs:element name="libros">
	<xs:complexType>
		<xs:sequence>
			<xs:element name="libro" maxOccurs="unbounded" minOccurs="0">
				<xs:complexType>
					<xs:sequence>
						<xs:element name="nombre">
							<xs:complexType>
								<xs:simpleContent>
									<xs:extension base="xs:string">
										<xs:attribute type="xs:short" name="paginas" use="optional"/>
									</xs:extension>
								</xs:simpleContent>
							</xs:complexType>
						</xs:element>
						<xs:element name="autor" type="xs:string"/>
						<xs:element name="editorial" type="xs:string"/>
						<xs:element name="precio" type="xs:float"/>
						<xs:element name="fecha" type="xs:integer"/>
					</xs:sequence>
				</xs:complexType>
			</xs:element>
		</xs:sequence>
	</xs:complexType>
</xs:element>

</xs:schema>